{"access":{"access_type":"zte_goform_http_single_lane","backend":"mc888","backend_family":"zte_goform_like","boot_static_refresh_policy":"identity_or_operator_refresh_only","dev2_state_read_gap_s":null,"direct_modem_writes_allowed":true,"discovery_mode":"known_profile","effective_match_required":true,"event_write_min_quiet_s":30.0,"fast_live_interval_s":2.0,"fast_live_stale_s":6.0,"fast_read_slo_s":2.0,"fast_sample_slo_warmup_samples":15,"fast_signal_connect_timeout_s":0.25,"fast_signal_read_timeout_s":1.05,"fast_traffic_cache_s":0.75,"fast_traffic_connect_timeout_s":0.12,"fast_traffic_max_timeout_s":0.35,"fast_traffic_min_timeout_s":0.12,"http_connection_mode":"close","lane_groups":{"boot_static":["device_identity","firmware","supported_bands","antenna_capability","qam_capability","sms_capability","wifi_capability"],"event_write":["band_selection","cell_lock","nr_band_lock","restart","wifi_toggle"],"export":["sidecars","support_bundle","history"],"fast_live":["radio_status","rf_quality","traffic_presence","traffic_volume","nr_status"],"slow_live":["ca_details","wifi_status","quota_stats","network_mode"]},"maintenance_connect_timeout_s":0.25,"maintenance_read_timeout_s":0.75,"min_inter_request_gap_s":0.5,"post_write_readback_deadline_s":30.0,"post_write_readback_delay_s":3.0,"proactive_session_refresh_enabled":true,"proactive_session_refresh_interval_s":180.0,"proactive_session_refresh_min_gap_s":60.0,"profile_id":"zte_mc888_goform_access_v1","read_retry_limit":1,"readback_required":true,"recovery_timing":{"rescue_window_s":120.0,"restart_verification_s":180.0},"routeros_state_read_gap_s":null,"session_connect_attempt_limit":1,"session_connect_retry_gap_s":0.0,"session_refresh_method":"zte_goform_ad","slow_live_interval_s":30.0,"write_retry_limit":1},"acquisition":{"clock_contract":"sampled_at is epoch seconds; monotonic_at is monotonic seconds; previous clocks retain the same domain","context_owner":"existing ModemLive acquisition state and Foundation provider policy; never an alternate controller","context_paths":["monotonic_at","provider_names","sampled_at","session_started_at","traffic_previous.rx","traffic_previous.tx"],"freshness_contract":"native parser defaults and retained values are not fresh facts; existing acquisition receipts and Matrix admission retain authority","previous_state_contract":"only the previous accepted observation from this same physical identity/session; preserve native source key and time","reads":[{"boundary":"transport-validated native reply; no caller-decoded measurement","fast_fields":["network_type","current_network_mode","modem_main_state","ppp_status","wan_active_band","wan_active_channel","wan_lte_ca","lte_ca_pcell_band","lte_ca_pcell_freq","lte_ca_scell_band","lte_ca_pcell_bandwidth","lte_ca_scell_bandwidth","lte_multi_ca_scell_info","lte_multi_ca_scell_sig_info","lte_ca_pcell_arfcn","lte_rsrp","lte_rsrq","lte_rssi","lte_snr","rssi","lte_rsrp_1","sinr","ecio","lte_pci","Z_PCI","lte_earfcn","Z_dl_earfcn","earfcn","cell_id","tac","mccmnc","network_provider","Z5g_rsrp","Z5g_rsrq","Z5g_snr","Z5g_PCI","Z5g_CELL_ID","Z5g_CELLINFO_band","Z5g_dlEarfcn","wan_rx_bytes","wan_tx_bytes","realtime_rx_bytes","realtime_tx_bytes","realtime_rx_thrpt","realtime_tx_thrpt"],"field_parameter":"cmd","method":"GET","parameters":{"isTest":"false","multi_data":"1"},"path":"/goform/goform_get_cmd_process","protocol":"zte_goform","reply":"goform","startup_fields":["network_type","current_network_mode","modem_main_state","ppp_status","ppp_uptime","wan_active_band","wan_active_channel","wan_lte_ca","lte_ca_pcell_band","lte_ca_pcell_freq","lte_ca_scell_band","lte_ca_pcell_bandwidth","lte_ca_scell_bandwidth","lte_multi_ca_scell_info","lte_multi_ca_scell_sig_info","lte_band","bandwidth","signalbar","lte_rsrp","lte_rsrq","lte_rssi","lte_snr","rssi","rscp","lte_rsrp_1","lte_rsrp_2","lte_rsrp_3","lte_rsrp_4","lte_snr_1","lte_snr_2","lte_snr_3","lte_snr_4","lte_pci","Z_PCI","lte_earfcn","Z_dl_earfcn","earfcn","cell_id","tac","lac_code","mccmnc","rmcc","rmnc","network_provider","network_provider_fullname","lte_band_lock","lte_freq_lock","lte_pci_lock","lte_earfcn_lock","ZCELLINFO_band","sinr","ecio","wan_ipaddr","wan_connected","wan_iface_name","imei","iccid","sim_imsi","imsi","sim_status","serial_number","model_name","product_name","hardware_version","wa_inner_version","web_version","cr_version","upgrade_result","tx_power","antenna_status","antenna_type","antenna_mode","ngbr_cell_info","lte_ca_pcell_arfcn","lte_ca_scell_arfcn","lte_ca_scell_info","5g_rx0_rsrp","5g_rx1_rsrp","Z5g_rsrp","Z5g_rsrq","Z5g_SINR","Z5g_snr","Z5g_PCI","network_Z5g_PCI","Z5g_CELL_ID","Z5g_CELLINFO_band","network_Z5g_CELLINFO_band","Z5g_dlEarfcn","nr5g_cell_id","nr5g_pci","nr5g_action_channel","nr5g_action_band","nr5g_action_nsa_band","nr_ca_pcell_band","nr_ca_pcell_freq","nr_multi_ca_scell_info","nr5g_nsa_bandwidth","nr5g_sa_band_lock","nr5g_nsa_band_lock","pm_sensor_ambient","pm_sensor_mdm","pm_sensor_5g","pm_sensor_pa1","pm_modem_5g","wifi_chip_temp","wan_rx_bytes","wan_tx_bytes","rx_bytes","tx_bytes","realtime_rx_bytes","realtime_tx_bytes","realtime_time","realtime_rx_thrpt","realtime_tx_thrpt","monthly_rx_bytes","monthly_tx_bytes","monthly_time","wifiEnabled","wifi_onoff_state","wifi_chip1_ssid1_switch_onoff","wifi_chip2_ssid1_switch_onoff","mac_address"]}],"write_contract":"capability/action metadata retained; native typed write stages and authorization are not implemented by this offline reader"},"algorithms":{"constants":{"CONNECTED_PPP_STATES":{"items":[{"kind":"constant","value":"connected"},{"kind":"constant","value":"connect"},{"kind":"constant","value":"ppp_connected"},{"kind":"constant","value":"ipv4_connected"},{"kind":"constant","value":"ipv6_connected"},{"kind":"constant","value":"ipv4_ipv6_connected"}],"kind":"set"},"NEGATIVE_STATES":{"items":[{"kind":"constant","value":""},{"kind":"constant","value":"disconnect"},{"kind":"constant","value":"disconnected"},{"kind":"constant","value":"not connected"},{"kind":"constant","value":"noservice"},{"kind":"constant","value":"no service"}],"kind":"set"}},"functions":{"goform_source_observed":{"body":[{"condition":{"kind":"compare","operations":["not_in"],"values":[{"kind":"name","name":"field"},{"kind":"name","name":"raw"}]},"kind":"if","no":[],"yes":[{"kind":"return","value":{"kind":"constant","value":false}}]},{"kind":"assign","targets":[{"kind":"name","name":"value"}],"value":{"key":{"kind":"name","name":"field"},"kind":"index","object":{"kind":"name","name":"raw"}}},{"condition":{"kind":"compare","operations":["is"],"values":[{"kind":"name","name":"value"},{"kind":"constant","value":null}]},"kind":"if","no":[],"yes":[{"kind":"return","value":{"kind":"constant","value":false}}]},{"condition":{"arguments":[{"kind":"name","name":"value"},{"kind":"name","name":"str"}],"function":{"kind":"name","name":"isinstance"},"keywords":[],"kind":"invoke"},"kind":"if","no":[],"yes":[{"kind":"return","value":{"kind":"compare","operations":["not_in"],"values":[{"arguments":[],"function":{"kind":"member","name":"lower","object":{"arguments":[],"function":{"kind":"member","name":"strip","object":{"kind":"name","name":"value"}},"keywords":[],"kind":"invoke"}},"keywords":[],"kind":"invoke"},{"items":[{"kind":"constant","value":""},{"kind":"constant","value":"null"},{"kind":"constant","value":"undefined"},{"kind":"constant","value":"n/a"},{"kind":"constant","value":"na"},{"kind":"constant","value":"--"},{"kind":"constant","value":"nan"},{"kind":"constant","value":"inf"},{"kind":"constant","value":"-inf"},{"kind":"constant","value":"-999"}],"kind":"set"}]}}]},{"condition":{"arguments":[{"kind":"name","name":"value"},{"items":[{"kind":"name","name":"list"},{"kind":"name","name":"tuple"},{"kind":"name","name":"set"},{"kind":"name","name":"frozenset"},{"kind":"name","name":"dict"}],"kind":"tuple"}],"function":{"kind":"name","name":"isinstance"},"keywords":[],"kind":"invoke"},"kind":"if","no":[],"yes":[{"kind":"return","value":{"arguments":[{"kind":"name","name":"value"}],"function":{"kind":"name","name":"bool"},"keywords":[],"kind":"invoke"}}]},{"kind":"return","value":{"kind":"constant","value":true}}],"emits":false,"kind":"function","name":"goform_source_observed","parameters":{"defaults":{},"keywords":{},"kwargs":null,"positional":["raw","field"],"varargs":null}},"is_limited_service":{"body":[{"kind":"return","value":{"arguments":[{"arguments":[{"kind":"constant","value":"limited[\\s_-]+service(?:[\\s_-]+[a-z0-9]+)*"},{"arguments":[],"function":{"kind":"member","name":"strip","object":{"arguments":[{"kind":"boolean","operation":"or","values":[{"kind":"name","name":"value"},{"kind":"constant","value":""}]}],"function":{"kind":"name","name":"str"},"keywords":[],"kind":"invoke"}},"keywords":[],"kind":"invoke"},{"kind":"member","name":"IGNORECASE","object":{"kind":"name","name":"re"}}],"function":{"kind":"member","name":"fullmatch","object":{"kind":"name","name":"re"}},"keywords":[],"kind":"invoke"}],"function":{"kind":"name","name":"bool"},"keywords":[],"kind":"invoke"}}],"emits":false,"kind":"function","name":"is_limited_service","parameters":{"defaults":{},"keywords":{},"kwargs":null,"positional":["value"],"varargs":null}},"normalize_band_list":{"body":[{"condition":{"kind":"unary","operation":"not","value":{"arguments":[{"kind":"name","name":"values"},{"kind":"name","name":"list"}],"function":{"kind":"name","name":"isinstance"},"keywords":[],"kind":"invoke"}},"kind":"if","no":[],"yes":[{"kind":"return","value":{"items":[],"kind":"list"}}]},{"kind":"assign","targets":[{"kind":"name","name":"out"}],"value":{"items":[],"kind":"list"}},{"body":[{"body":[{"kind":"assign","targets":[{"kind":"name","name":"band"}],"value":{"arguments":[{"kind":"boolean","operation":"or","values":[{"kind":"name","name":"raw"},{"kind":"constant","value":0}]}],"function":{"kind":"name","name":"int"},"keywords":[],"kind":"invoke"}}],"else":[],"finally":[],"handlers":[{"body":[{"kind":"assign","targets":[{"kind":"name","name